{"$schema":"https://json-schema.org/draft/2020-12/schema","title":"CleanupRules","description":"Ordered whole cleanup set. An empty set explicitly does no cleanup.","type":"object","properties":{"collection_id":{"description":"Declared `collection_id`; no inferred default.","type":"string","maxLength":128,"minLength":1,"pattern":"^[A-Za-z0-9][A-Za-z0-9_.-]*$"},"id":{"description":"Declared `id`; no inferred default.","type":"string","maxLength":128,"minLength":1,"pattern":"^[A-Za-z0-9][A-Za-z0-9_.-]*$"},"owner_ref":{"description":"Declared `owner_ref`; no inferred default.","$ref":"#/$defs/PolicyReference"},"qualification":{"description":"External admission, never self-approval.","$ref":"#/$defs/PolicyReference"},"rules":{"description":"Unique rules sharing N15's cumulative AST bounds.","type":"array","items":{"$ref":"#/$defs/CleanupRule"},"maxItems":1000},"schema":{"description":"Declared `schema`; no inferred default.","$ref":"#/$defs/CleanupSchema"},"scope_tags":{"description":"Declared `scope_tags`; no inferred default.","type":"array","items":{"type":"string"},"maxItems":10000},"version":{"description":"Declared `version`; no inferred default.","type":"integer","format":"uint64","minimum":1},"visibility":{"description":"Declared `visibility`; no inferred default.","$ref":"#/$defs/Visibility"}},"additionalProperties":false,"required":["schema","id","version","collection_id","visibility","scope_tags","owner_ref","rules","qualification"],"$defs":{"Attribute":{"description":"Attribute: the plan’s strict wire record.","type":"object","properties":{"name":{"description":"Declared `name`; no inferred default.","type":"string","maxLength":128,"minLength":1,"pattern":"^[A-Za-z0-9][A-Za-z0-9_.-]*$"},"value":{"description":"Declared `value`; no inferred default.","type":"string","maxLength":4096}},"additionalProperties":false,"required":["name","value"]},"CleanupAction":{"description":"Only navigation omission is available; no rewrite operation.","oneOf":[{"description":"Omit one matched navigation unit, retaining original evidence.","type":"string","const":"omit_navigation"}]},"CleanupRule":{"description":"One ordered, bounded cleanup rule over N15 observations.","type":"object","properties":{"action":{"description":"Closed action.","$ref":"#/$defs/CleanupAction"},"id":{"description":"Unique rule identity.","type":"string","maxLength":128,"pattern":"^[A-Za-z0-9][A-Za-z0-9_.-]*$"},"reason_code":{"description":"Auditable reason identity.","type":"string","maxLength":128,"pattern":"^[A-Za-z0-9][A-Za-z0-9_.-]*$"},"selector":{"description":"The existing observation AST, not a new selector language.","$ref":"#/$defs/Structure"}},"additionalProperties":false,"required":["id","selector","action","reason_code"]},"CleanupSchema":{"description":"Closed cleanup artifact version.","oneOf":[{"description":"Version one.","type":"string","const":"maestro-cleanup-rules/1"}]},"DomStep":{"description":"`DomStep`: the plan’s strict wire record.","type":"object","properties":{"attributes":{"description":"Declared `attributes`; no inferred default.","type":"array","items":{"$ref":"#/$defs/Attribute"},"maxItems":8},"tag":{"description":"Declared `tag`; no inferred default.","type":"string","maxLength":128,"minLength":1,"pattern":"^[A-Za-z0-9][A-Za-z0-9_.-]*$"}},"additionalProperties":false,"required":["tag","attributes"]},"JsonStep":{"description":"Exact JSON path step, never an executable query.","oneOf":[{"description":"Literal field name.","type":"object","properties":{"kind":{"type":"string","const":"field"},"name":{"description":"Bounded nonempty name.","type":"string"}},"additionalProperties":false,"required":["kind","name"]},{"description":"Fixed unsigned array index.","type":"object","properties":{"kind":{"type":"string","const":"index"},"value":{"description":"Position in an observed array.","type":"integer","format":"uint32","minimum":0}},"additionalProperties":false,"required":["kind","value"]}]},"Observation":{"description":"Atomic bounded structure observation.","oneOf":[{"description":"Literal DOM tag/attribute path.","type":"object","properties":{"kind":{"type":"string","const":"dom"},"path":{"description":"Nonempty direct-child path.","type":"array","items":{"$ref":"#/$defs/DomStep"}}},"additionalProperties":false,"required":["kind","path"]},{"description":"Literal JSON field/index path.","type":"object","properties":{"kind":{"type":"string","const":"json"},"path":{"description":"Nonempty bounded path.","type":"array","items":{"$ref":"#/$defs/JsonStep"}}},"additionalProperties":false,"required":["kind","path"]},{"description":"Existing structural block kind.","type":"object","properties":{"id":{"description":"Exact block kind ID.","type":"string"},"kind":{"type":"string","const":"block"}},"additionalProperties":false,"required":["kind","id"]},{"description":"Literal content prefix.","type":"object","properties":{"kind":{"type":"string","const":"prefix"},"text":{"description":"Bounded nonempty prefix.","type":"string"}},"additionalProperties":false,"required":["kind","text"]}]},"PolicyReference":{"description":"A source-policy resource identity, not a path or an access grant.","type":"object","properties":{"digest":{"description":"Exact immutable SHA-256 resource digest.","type":"string","pattern":"^[0-9a-f]{64}$"},"id":{"description":"Logical resource identifier, validated by the source-policy resolver.","type":"string","maxLength":128,"minLength":1,"pattern":"^[A-Za-z0-9][A-Za-z0-9_.-]*$"}},"additionalProperties":false,"required":["id","digest"]},"Structure":{"description":"Bounded declarative structure AST; no arbitrary executable selectors.","oneOf":[{"description":"Exact atomic structure observation.","type":"object","properties":{"kind":{"type":"string","const":"observed"},"observation":{"description":"One bounded atomic selector.","$ref":"#/$defs/Observation"}},"additionalProperties":false,"required":["kind","observation"]},{"description":"Every child must match.","type":"object","properties":{"children":{"description":"Nonempty bounded children.","type":"array","items":{"$ref":"#/$defs/Structure"}},"kind":{"type":"string","const":"all"}},"additionalProperties":false,"required":["kind","children"]},{"description":"At least one child must match.","type":"object","properties":{"children":{"description":"Nonempty bounded children.","type":"array","items":{"$ref":"#/$defs/Structure"}},"kind":{"type":"string","const":"any"}},"additionalProperties":false,"required":["kind","children"]}]},"Visibility":{"description":"The closed set of Visibility values.","oneOf":[{"description":"`public`.","type":"string","const":"public"},{"description":"`private`.","type":"string","const":"private"}]}}}
