{"schema":"maestro-cleanup-rules/1","id":"cleanup",
"version":1,"collection_id":"garden","visibility":"public",
"scope_tags":["workspace/default/collection/garden"],
"owner_ref":{"id":"owner","digest":"0000000000000000000000000000000000000000000000000000000000000000"},
"rules":[{"id":"navigation","selector":{"kind":"observed",
"observation":{"kind":"block","id":"navigation"}},
"action":"omit_navigation","reason_code":"chrome"}],
"qualification":{"id":"qualification","digest":"1dbf39600b5761d58378447f494a50c8b9c01b559b6ef420720f99f4e45717c9"}}
